"X","user_username","text","tweet_id","lang","sourcetweet_type","quote_count","user_verified","extracted_hashtags","tagged"
10309,"stevesilberman","i be not a king crimson fanatic or anything but dear lord i can not wait to see this new documentary and psst fripp set off my radar just sayin",1503824338541154304,"en","999",0,TRUE,"#neurodiversity",""
10423,"unevadareno","worth celebrate move beyond neurodiversity awareness",1503847010901798912,"en","999",0,TRUE,"",""
10450,"TamaraMcCleary","address the gap through neurodiversity",1503961763599065088,"en","999",0,TRUE,"#cybersecurity #skills",""
10476,"natashabadhwar","the only sure reference i have for life advice be my own story use me as a datum point i conclude that one of the much damage thing to wellbeing can be to live in hide from yourself a on",1503940186501046272,"en","999",0,TRUE,"#Autism #Neurodiversity #ActuallyAutistic","@TayZonday"
10540,"unevadareno","worth celebrate move beyond neurodiversity awareness",1503875580776701952,"en","999",0,TRUE,"",""
10833,"CityUniLondon","next week mark a worldwide initiative that aim to transform how neurodivergent individual be perceive and support find out how you can get involve with the activity and event",1504049879286431744,"en","999",0,TRUE,"#NeurodiversityCelebrationWeek",""
10973,"paulbristow79","next week i be support the launch of neurodiversity in business with my constituent this be the time for neurodivergent talent i can not agree with dan much next week we launch in parliament and i can not be proud",1504101695185371136,"en","999",1,TRUE,"","@NDinBusiness @DanielJHarrisUK"
11000,"Booktrust","it be so we be return to this brilliant piece from about her own experience of neurodiversity and the incredible power of authentic representation in story",1504097156222885888,"en","999",1,TRUE,"#NeurodiversityCelebrationWeek","@BooksandChokers"
11010,"cityandguilds","and host this workshop design to give a great understand of neurodiversity overcome potential learn barrier lead to improve engagement successful outcome and progression visit",1504095325530857472,"en","999",0,TRUE,"#FEWeekAAC","@appslevy_expert @profamandakirby"
11324,"RIBA","from to march we will be join individual and organisation across the globe to participate in neurodiversity celebration week take a look at our selection of event activity and relevant resource",1504138266420908032,"en","999",0,TRUE,"#NeurodiversityCelebrationWeek",""
11413,"revkatebottley","me and my lad go to visit the highland coo today",1504155361795792896,"en","999",1,TRUE,"#Neurodiversity",""
11460,"CRAE_IOE","a final thank you to everyone who attend the lecture and the without whom crae would not be able to do what it do this annual lecture will be available on our youtube channel soon and you can download slide here",1504172238374944768,"en","999",0,TRUE,"","@PearsFoundation @SueReviews"
11482,"CRAE_IOE","a neurodiversity affirmative school should expect diversity teach selfadvocacy fight stigma and profile the individual not the label this can be do through collaborative coproduced researchbased resource and join force to campaign for systemic change",1504170611379167232,"en","999",3,TRUE,"",""
11483,"CRAE_IOE","to finish sue reiterate her take home message that autism should be understand through a neurodiversity paradigm and apply neurodiversity in school require a shift in perspective not just language",1504170609034551296,"en","999",0,TRUE,"",""
11487,"CRAE_IOE","sue team think it be important to teach about neurodiversity to reflect on a diversity of experience provide alternative narrative about why school can be hard normalise the concept of need provide answer and reinforce privacy",1504170122587611136,"en","999",0,TRUE,"",""
11488,"CRAE_IOE","to create a neurodiversity affirmative school sue highlight the learn about neurodiversity at school project at run by that aim to create and evaluate a course to teach about neurodiversity as a whole class",1504169916869525504,"en","999",0,TRUE,"#LEANSproject","@SMRCResearch @a_m_alcorn0131"
11489,"CRAE_IOE","neurodiversity require a rethink of how and why thing be do in school and neurodiversity affirmative school would do the follow",1504169908682297344,"en","999",0,TRUE,"",""
11490,"CRAE_IOE","the neurodiversity paradigm do not reject the concept of disability",1504169907101093888,"en","999",1,TRUE,"",""
11491,"CRAE_IOE","neurodiversity do not only focus on the strength and talent of individual",1504169905557577728,"en","999",0,TRUE,"",""
11492,"CRAE_IOE","neurodiversity be not a synonym for special educational need or disability send or rare and this be important to acknowledge to avoid just change language but not action and fail to deliver on how inclusive acknowledge neurodiversity can be",1504169903913283584,"en","999",0,TRUE,"",""
11493,"CRAE_IOE","sue highlight some common misunderstanding about neurodiversity",1504169901589774336,"en","999",0,TRUE,"",""
11494,"CRAE_IOE","the neurodiversity paradigm can replace core deficit model neurodiversity be the fact that all human being vary in the way our brain take in information process it and thus behave neurodiversity explain both individual and labelledgroup difference",1504169900025253888,"en","999",0,TRUE,"",""
11495,"CRAE_IOE","finally before sue start the lecture she highlight she be cochairing a international neurodiversity conference in march it take all kind of mind bring to you by at the edinburgh international conference centre and online",1504169888121860096,"en","999",0,TRUE,"","@MindroomInform"
11496,"CRAE_IOE","s be focus on educational inequality and learn diversity and adopt a neurodiversity framework in everything they do",1504169884401516544,"en","999",0,TRUE,"","@SMRCResearch"
11497,"CRAE_IOE","sue particularly thank and two of sue marvellous colleague focus on neurodiversity in education as she mention on a lot of their work in the talk",1504169880928591872,"en","999",0,TRUE,"","@a_m_alcorn0131 @cjcrompton"
11558,"hirevue","of year old with attend college but of college grad wautism be underemployed or unemployed this number be unacceptable listen to the late podcast for practical advice to flip that statistic on its head",1504187255501508608,"en","999",0,TRUE,"#autism","@AtWorkInAmerica"
11568,"abc_everyday","when school be the source of your child extreme anxiety and meltdown",1504185768398495744,"en","999",0,TRUE,"",""
11610,"eatlikeagirl","i know this sound cold it be not he be a friend but we be both very peculiar people hello neurodiversity who do not desire flatmate so it work as a interim solution in a city like london where rent be so high we would both love our own place amp be work towards it",1504221438072532992,"en","999",0,TRUE,"",""
11626,"dyslexicadv","premium have you ever use autotext and macro simplify write and other work task use technology",1504215937364504576,"en","999",0,TRUE,"#dyslexia #dyslexicadvantage #neurodiversity #macros #technology #apps",""
11865,"Kate_Nancarrow","inclusive school that support neurodiverse need can be hard to find",1504345274445049856,"en","999",1,TRUE,"#anxiety #ASD #autism #PDA",""
11961,"chrisdancy","i create this for so i can talk about productivity through the lens of and value two other favorite be my time domain",1504383071591747584,"en","999",0,TRUE,"#Neurodiversity","@meshachthomas @juvoni @KeepProductive"
12101,"Booktrust","i do not regret have asd not even a little bite in fact i think of it as my superpower and i be grateful for it we love this piece from dr camilla yang about her experience of neurodiversity",1504444193623715840,"en","999",0,TRUE,"#NeurodiversityCelebrationWeek",""
12548,"clickup","we be just a neurodiverse bunch try to make the world much productive",1504511161470967808,"en","999",0,TRUE,"","@kenster1994"
12584,"hirevue","of year old with attend college but of college grad wautism be underemployed or unemployed this number be unacceptable listen to the late podcast for practical advice to flip that statistic on its head",1504549892416581632,"en","999",0,TRUE,"#autism","@AtWorkInAmerica"
12837,"eatlikeagirl","putting my weird bin obsession especially the obsession with my bin down to neurodiversity i swear i will get up early to get my bin back they catch me go in to get it before why do they take it because this i guess",1504612592693792768,"en","999",0,TRUE,"",""
12871,"LPTnhs","we be support neurodiversity celebration week neurodiversity celebration week a worldwide initiative that challenge stereotype and misconception about neurological difference",1504750718116417536,"en","999",0,TRUE,"",""
13263,"edgehill","next week be join us on thursday march for a online session from joanne day senior lecturer in nurse education who will speak about neurodiversity and her live experience to book email staffwellbeinganddevelopmentacuk",1504839325636349952,"en","999",0,TRUE,"#NeurodiversityCelebrationWeek","@edgehill"
13401,"RIBA","next thursday march pm join lead access consultant and architect jane simpson helen kane and jean hewitt for a online seminar as they share how architect can good consider neurodiversity in design",1504850252523839488,"en","999",1,TRUE,"#NeurodiversityCelebrationWeek",""
13707,"PACEYchildcare","thank you to everyone who join us for our pacey live webinar last night we hope you find it useful we speak to dr pooja sharma from about neurodiversity in the early year do not worry if you miss it member can catch up here",1504895411307356160,"en","999",0,TRUE,"","@CDC_tweets"
13992,"SMeadows4OH2","if you have time today please take a moment to familiarize yourself with some unseen disability there be many of us who have one amp it be frustrate disability come in many different form",1505014290469822464,"en","999",0,TRUE,"#DisabilityAwarenessMonth #Neurodiversity",""
14412,"Booktrust","there be a lot about me that do not really make sense in fact this be probably my favourite part of myself we love this piece from dr camilla pang about her experience of neurodiversity and her top tip for support neurodiverse child",1505191115464613888,"en","999",0,TRUE,"",""
14549,"ShephaliBhatt","you can not expect the prepandemic level of productivity from a traumatise population write about what may have lead to the undo of hustle culture the funny sigma male grindset meme scope for slow productivity hustle amp neurodiversity and much",1505413538004701184,"en","999",30,TRUE,"",""
14562,"natashabadhwar","when i be diagnose i become far much compassionate toward myself which probably halve the distress of the occasion you be a gift to humanity",1505388167977115648,"en","999",0,TRUE,"#Autism #Neurodiversity #SelfAdvocacy","@Hannahgadsby"
14565,"natashabadhwar","i be a visual thinker i see my thought but i do not have a photographic memory nor be my head a static gallery of sensibly collect thought that my brain curate into easy sense it be not linear it be fluid and flexible",1505382463694319616,"en","999",0,TRUE,"#Autism #Neurodiversity",""
14655,"MattHancock","tomorrow be the start of neurodiversity celebration week a worldwide initiative that challenge stereotype and misconception about learn disability include dyslexia ahead of this year i speak to on about my dyslexia campaign",1505471918438236160,"en","999",2,TRUE,"","@NCWeek @TomSwarbrick1 @LBC"
14943,"stevesilberman","bravo to the club for invite kid to design tshirts while specifically ask them not to use puzzle piece which people associate with autism speak and be think of as flaw and incomplete",1505603680531230720,"en","999",0,TRUE,"#Neurodiversity #autistic","@MillburnHS_News"
15067,"hirevue","of year old with attend college but of college grad wautism be underemployed or unemployed this number be unacceptable listen to the late podcast for practical advice to flip that statistic on its head",1505629754321481728,"en","999",0,TRUE,"#autism","@AtWorkInAmerica"
15223,"countiesmanukau","it be neurodiversity celebration week a global initiative that aim to help the world to understand value and celebrate the talent of neurodiverse mind people be at the heart of everything we do at county manukau health so we be proud to be par",1505757288082063360,"en","999",0,TRUE,"",""
15227,"CFCAexchange","miss our webinar on support the developmental need of child with neurodiversity you can now watch the record and download the slide from our website",1505752366007689216,"en","999",0,TRUE,"",""
15261,"GoogleCloud_SG","jim hogan a leader of s disability alliance amp neurodiversity advocate share how the small thing can make a big difference like the raise hand feature in or the suggest text feature in",1505725928596459520,"en","999",0,TRUE,"#Google #GoogleMeet #Gmail",""
15390,"HealthierLSC","today mark the first day of neurodiversity celebration week be empower every individual by challenge stereotype and misconception about neurological difference",1505821764835762176,"en","999",0,TRUE,"","@reciteme"
15423,"MSEssex_ICS","we be support neurodiversity celebration week from march the purpose of be to help the world to understand value and celebrate the talent of neurodiverse mind find out much here",1505816924588244992,"en","999",0,TRUE,"#NeurodiversityCelebrationWeek #neurodiversityweek","@NCWeek"
15432,"bedspolice","this week be neurodiversity celebration week and we want to take this opportunity to tell you all about our pegasus scheme the scheme be for people who find it hard to communicate with us registration be free",1505816684329852928,"en","999",2,TRUE,"",""
15438,"DCP_Diversity","neurodiversity celebration week be a weeklong event design to provide a opportunity for people to learn much about neurodiversity and for neurodiverse people to develop a much positive perception of their own unique neurodiverse trait and skill",1505816485666512896,"en","999",0,TRUE,"",""
15495,"SurreyHeartland","we be support there be numerous event take place throughout the week include webinars panel discussion and much the event aim to educate and encourage conversation around neurodiversity find out much",1505831760030015488,"en","999",0,TRUE,"#NeurodiversityCelebrationWeek",""
15503,"SyHeartlandsCCG","we be support there be numerous event take place throughout the week include webinars panel discussion and much the event aim to educate and encourage conversation around neurodiversity find out much",1505831604257763328,"en","999",0,TRUE,"#NeurodiversityCelebrationWeek",""
15507,"HumbersideFire","we be celebrate neurodiversity and support by have a staff disability group we here to support our staff and aim to create a neuroinclusive environment that help different mind thrive",1505831581621051392,"en","999",1,TRUE,"#NeurodiversityCelebrationWeek #NeurodiversityCelebrationWeek #Accessibility",""
15536,"SouthOxon","we support neurodiversity celebration week which start today it be a worldwide initiative that challenge stereotype and misconception about neurological difference much information be available here",1505827804822319104,"en","999",0,TRUE,"#NeurodiversityCelebrationWeek",""
15540,"MattHancock","that be why i have be campaign for universal screen for dyslexia in primary school teacher train for neurodiversity amp good support i be delight that after my meet with the minister commit to early identification amp teacher train",1505827579718156288,"en","999",0,TRUE,"","@WillQuince"
15573,"RIBA","happy we be join individual and organisation across the world highlight the importance of neurodiversity by host and support event and share relevant material to help improve understand take a look",1505842834749992960,"en","999",0,TRUE,"#NeurodiversityCelebrationWeek",""
15692,"NorthWalesFire","today mark the first day of neurodiversity celebration week together with we be empower every individual by challenge stereotype and misconception about neurological difference",1505847040059883520,"en","999",0,TRUE,"#NeurodiversityCelebrationWeek #Accessibility #Diversity #Inclusion","@reciteme"
15703,"Hullccnews","competition for young people to celebrate neurodiversity week launch by close date st march",1505846939828563968,"en","999",0,TRUE,"#NDWHull22 #NeurodiversityCelebrationWeek","@Hullccnews @JCYEB_Hull @HullFerens"
15715,"ICAEW","holly share the worry she have when she be diagnose with adhd as we celebrate hear from much of our member on our hub gt",1505846784056340480,"en","999",0,TRUE,"#NeurodiversityWeek #WelcomeInclusion #icaewDiversity #everyonecounts #inclusion #neurodiversity #adhd",""
15720,"MSDintheUK","this we be delight that our uk capability network be launch a employee train programme and support network to help us far understand neurodiversity and how important it be to our organisation",1505846720512593920,"en","999",2,TRUE,"#NeurodiversityCelebrationWeek #WeAreMSD","@NCWeek"
15752,"iom3","neurodiversity celebration week myth bust",1505844649151369216,"en","999",0,TRUE,"#NeuroDiversityCelebrationWeek",""
15754,"SolentNHSTrust","join us as we join the rest of the world in challenge stereotype and misconception about neurodiversity check out event plan this week and take part and learn and share",1505844290265784320,"en","999",0,TRUE,"#NeurodiversityCelebrationWeek",""
15762,"SSE","in people be mean their brain function learn amp process information differently this week aim to increase awareness and understand around and we be educate employee on create a neuroinclusive team and workplace",1505843910924386304,"en","999",0,TRUE,"#neurodivergent #neurodiversity","@NCWeek"
15871,"MFCFoundation","today be the first day of neurodiversity celebration week together with we be recognise the talent and advantage of be neurodivergent while create much diverse and inclusive community",1505860282958192640,"en","999",0,TRUE,"#NeurodiversityCelebrationWeek #Accessibility #Diversity #Inclusion","@reciteme"
15905,"CSSDLondon","today mark the first day of neurodiversity celebration week we be please to offer technology on our website help to improve access to our information and empower that with neurological difference",1505858018247856128,"en","999",0,TRUE,"#NeurodiversityCelebrationWeek #Accessibility #Inclusion","@reciteme"
15931,"WokinghamBC","find out much about neurodiversity",1505857147514638336,"en","999",0,TRUE,"",""
15932,"WokinghamBC","it be neurodiversity celebration week a worldwide initiative that set out to challenge stereotype and misconception about learn difference the week aim to transform how neurodivergent individual be perceive and support provide a opportunity to recognise",1505857141676068864,"en","999",0,TRUE,"",""
15950,"SJPHeadTeacher","this week sjp be take part in neurodiversity celebration week take a look at some of the panel event take place online much detail can be find on the website",1505855553662242816,"en","999",1,TRUE,"#NeurodiversityCelebrationWeek","@NCWeek"
16012,"RandstadJobs","learn how different communication style can be use to improve productivity good accommodate people with neurodiverse condition amp identify strength that may be of benefit to your organisation",1505862537035853824,"en","999",0,TRUE,"#NeurodiversityCelebrationWeek",""
16029,"JPFoundation","in light of neurodiversity week here be a great space of resource for student provide by recognise neurological difference amp way you can support and empower every individual click below",1505861916098535424,"en","999",0,TRUE,"#neurodiversityweek #neurodiversityweek2022","@NCWeek"
16069,"HolSmale","during neurodiversity week i would love to stop see people talk about dyspraxia as simply a physical disability dyspraxia be not just clumsiness or a lack of grossfine motor skill it also impact the brain learn and speech and heres why that matter",1505872393667031040,"en","999",122,TRUE,"",""
16091,"AstraZeneca","for us be another reminder of the strength our difference bring read what ashley one of our neurodivergent colleague have to say",1505870655253884928,"en","999",1,TRUE,"#NeurodiversityCelebrationWeek",""
16158,"BDAdyslexia","neurodiversity in business nib be a new initiative launch march nd at the house of common with the mission to ensure great workplace inclusion of the neurodivergent community find out much",1505877168940892160,"en","999",1,TRUE,"",""
16181,"cisweb","today mark the first day of neurodiversity celebration week together with we aim to empower every individual by challenge stereotype and misconception about neurological difference",1505876884571123712,"en","999",0,TRUE,"#NeurodiversityCelebrationWeek #Accessibility #Diversity #Inclusion","@reciteme"
16182,"hughbaird","we be proud to be support neurodiversity celebration week to celebrate our neurodiverse staff and student",1505876879479386112,"en","999",0,TRUE,"#NeurodiversityWeek","@NCWeek"
16250,"ccs_nhst","this week be neurodiversity celebration week cc be proud to be support this and celebrate difference as a positive force for change visit the web page and register for some of the event take place",1505873114579836928,"en","999",0,TRUE,"#NeurodiversityWeek #GoTeamCCS",""
16259,"LeonardCheshire","today kicksoff celebration week so we have ask the wonderful to share what he mean when he say he be as good as his tip for support a neurodivergent person",1505882752687788032,"en","999",1,TRUE,"#Neurodiversity #Neurodivergent","@LiamODellUK"
16269,"skillsdevscot","it be we want to bridge the gap between scotlands employer and the highlyskilled neurodivergent workforce that be out there learn much",1505882144169775104,"en","999",1,TRUE,"#NeurodiversityCelebrationWeek #UntappedTalent #BrainBytes",""
16330,"AIGemea","aig celebrate to recognise the contribution bring to our workplace",1505878136101212160,"en","999",0,TRUE,"#NeurodiversityCelebrationWeek #neurodiversity #NeurodiversityWeek #BeingYouAIG",""
16391,"jpitney","today start it aim to challenge stereotype about people with and other neurological difference",1505886362964176896,"en","999",0,TRUE,"#NeurodiversityCelebrationWeek #autism",""
16426,"scotlandis","we be collaborate with to help bridge the gap between scotlands employer and the highlyskilled workforce that be out there find out much about this wealth of",1505884615889895424,"en","999",0,TRUE,"#Neurodivergent #UntappedTalent #BrainBytes","@skillsdevscot"
16484,"leedscitycoll","this week be neurodiversity celebration week it be a week that aim to transform how neurodivergent individual be perceive and challenge misconception and stereotype",1505892098897285120,"en","999",0,TRUE,"#NeurodiversityWeek #Neurodiversity #Leeds",""
16494,"bedspolice","this week be neurodiversity celebration week and we want to take this opportunity to tell you all about our pegasus scheme the scheme be for people who find it hard to communicate with us",1505891648416460800,"en","999",0,TRUE,"",""
16597,"SophieRunning","celebrate neurodiversity should be just that a appreciation of unusual way of think and the way it can unlock progress for the rest of us when we honour difference we be all good off",1505898082235568128,"en","999",1,TRUE,"#NeurodiversityWeek",""
16619,"RIBANorthWest","join lead access consultant and architect jane simpson and helen kane who will provide a accessible guide for architect on neurodiversity and design in our free webinar on march book your ticket",1505896268647784448,"en","999",0,TRUE,"",""
16652,"BizGrowthHub","in our recent interview ceo of discuss the label and misconception that society can have around autistic people read the full interview here",1505907107677323264,"en","999",0,TRUE,"#NeurodiversityCelebrationWeek #Neurodiversity #Autism #SMEUK #BizHour","@Teamkarting @mattystreet96"
16659,"BBCCape","job hunt for neurodivergent people ai recruitment mean i have get zero chance facial analysis technology be sometimes use in recruitment but accord to people it can be bias against them",1505906683889041408,"en","999",0,TRUE,"#neurodivergent #Neurodiversity",""
16707,"NorthantsPolice","for neurodiversity celebration week we will be release a series of film today the first of the video focus on adhd amp feature neurodivergent police officer amp firefighter full film here",1505903747121262592,"en","999",2,TRUE,"#neurodiversityweek #NCW","@northantsfire @NorthantsOPFCC"
16715,"nandwics","this week be neurodiversity celebration week we be proud to be support and celebrate difference as a positive force for change visit the web page below and register for some of the event take place",1505903314319335424,"en","999",0,TRUE,"#NeurodiversityWeek",""
16814,"NHSEmployers","as part of neurodiversity celebration week march benjamin ford a behavioural therapist in the nhs with live experience of autism discuss the importance of support neurodivergent colleague in the nhs",1505908088905224192,"en","999",1,TRUE,"",""
16830,"NatResWales","today mark the start of neurodiversity celebration week a worldwide initiative that challenge stereotype and misconception about neurological difference click here to find out much about the initiative and what you can do to take part",1505907485001252864,"en","999",0,TRUE,"",""
16850,"ASPHFT","today mark the first day of neurodiversity celebration week together with we be empower every individual by challenge stereotype and misconception about neurological difference",1505919518794731520,"en","999",0,TRUE,"#NeurodiversityCelebrationWeek #Accessibility #Diversity #Inclusion","@reciteme"
16987,"NorthumbriaNHS","so often conversation surround neurodiversity be about challenge the person may have rather than what they can and will accomplish look to flip that conversation and make change for the good for everyone",1505922230710161408,"en","999",0,TRUE,"#NeurodiversityCelebrationWeek",""
16989,"TheIET","it be a chance to celebrate our difference and highlight the incredible neurodiversity within we will be share a few profile from our list so keep your eye peel read our impact full list here",1505922229200207872,"en","999",0,TRUE,"#NeurodiversityCelebrationWeek #STEM #CelebrateImpact",""
